id,cate,title,lead,time,tag659645,Ô tô - Xe máy,Dàn siêu xe sang cực phẩm hội tụ tại Thái Lan,"Triển lãm Bangkok Motor Show 2020 đang diễn ra với sự quy tụ của hàng loạt siêu xe sang hàng ""hot"" thu hút sự chú ý của công chúng yêu xe.",22-07-2020,"['siêu xe', 'triển lãm xe', 'xe sang']"
549365,Kinh Doanh,Bitcoin ‘sập sàn’ vẫn đè bẹp các tiền ảo khác,"Giá Bitcoin sáng nay giảm 6,35% nhưng vốn hóa tiền ảo này vẫn thống trị thị trường khi chiếm tới 65% tổng vốn hóa.",11-07-2019,"['đồng Bitcoin', 'giá bitcoin', 'Bitcoin', 'tiền ảo']"
611807,Kinh Doanh,"Hàng độc: Lan rừng 'uống' nước luộc đu đủ, tiêu 'ăn' trứng vịt","Những giò lan rừng được 'uống' nước luộc đu đủ sinh trưởng và phát triển rất tốt. Còn những cây tiêu 'ăn' phân cua, trứng vịt, sữa, bán giá cao gấp 400 lần.",26-01-2020,"['hoa đào', 'thịt lợn', 'hoa tết', 'thưởng Tết', 'cây cảnh', 'lan rừng']"
611331,Kinh Doanh,"Lạ, cho lan rừng 'uống' nước luộc đu đủ thu hàng trăm triệu","Nhờ cách làm lạ mà hay là chăm cả nghìn giò lan rừng bằng nước luộc lá đu đủ, anh Tòng Văn Din (Sơn La) nhẹ nhàng bỏ túi 300 triệu đồng mỗi năm.",22-01-2020,"['lan rừng', 'hoa lan', 'tỷ phú nông dân']"
616836,Kinh Doanh,"Vườn lan rừng 'khủng' của 9X Quảng Nam, có 10.000 giò giả hạc","Năm 2016, sau khi xuất ngũ về lại quê hương, anh Huỳnh Đức Tài (SN 1995, ở thôn 3, xã Tiên Mỹ, huyện Tiên Phước, Quảng Nam) đã chọn mô hình trồng lan rừng làm hướng vừa thỏa đam mê vừa làm kinh tế.",16-02-2020,"['lan rừng', 'hoa lan', 'lan quý']"
544253,Kinh Doanh,"Tiền ảo phân hóa mạnh, Bitcoin sát ngưỡng 11.000 USD","Giá Bitcoin sáng nay 24/6 tiếp tục tăng thêm 1,25% lên 10.842 USD, trong khi loạt tiền ảo vốn hóa nhỏ hơn chìm sâu trong sắc đỏ.",24-06-2019,"['tiền ảo', 'Bitcoin']"
549847,Kinh Doanh,Con đường dẫn đến lao lý của ông Lê Tấn Hùng,"Ông Lê Tấn Hùng, nguyên Tổng giám đốc Sagri, bị bắt để điều tra về tội vi phạm quy định về quản lý, sử dụng tài sản Nhà nước gây thất thoát, lãng phí.",13-07-2019,"['Lê Tấn Hùng', 'Sagri']"
622181,Ô tô - Xe máy,"Hàng loạt triển lãm ô tô lớn bị hoãn, huỷ vì đại dịch Covid-19","Lần lượt các triển lãm ô tô quốc tế lớn ở Bắc Kinh (Trung Quốc), Geneva (Thuỵ Sĩ) và giờ đây là Bangkok (Thái Lan) đã bị huỷ bỏ do lo ngại sự lây lan của virus corona.",06-03-2020,"['virus corona', 'hoãn triển lãm ô tô']"
507664,Kinh Doanh,Chiêu mới: Kiếm 150 triệu đồng/tháng nhờ 'ăn xin' trên mạng xã hội,Người thanh niên cho rằng mình nổi tiếng ngang với các ngồi sao truyền hình thực tế.,13-02-2019,"['ăn mày', 'ăn xin']"
623428,Ô tô - Xe máy,Triển lãm ô tô New York chính thức bị tạm hoãn do Covid -19,Ban tổ chức New York Auto Show 2020 đã buộc phải đưa ra thông báo tạm ngừng triển lãm trong bối cảnh dịch Covid-19 đang lây lan với tốc độ khủng khiếp tại Mỹ.,11-03-2020,"['triển lãm ô tô', 'virus corona']"
564471,Kinh Doanh,"Chấn động, thiếu gia kế thừa tập đoàn lớn chơi ma túy bị bắt tại sân bay",Là người thừa kế những gia sản tiền tỷ nhưng các thiếu gia lại vướng ngay vào lao lý khi tuổi đời còn quá trẻ.,03-09-2019,"['con trai tập đoàn', 'thiếu gia', 'tập đoàn Hàn Quốc', 'Hàn Quốc', 'Chaebol']"
545325,Kinh Doanh,"Bitcoin tiếp tục tăng 'phi mã', thị trường náo loạn","Trong phiên giao dịch hôm nay 27/6, Bitcoin tiếp tục tăng giá rất mạnh, có lúc vượt ngưỡng 13.000 USD, đạt ""đỉnh"" 18 tháng.",27-06-2019,"['tiền ảo', 'giá bitcoin', 'Bitcoin', 'đồng Bitcoin']"
525475,Kinh Doanh,"Đại gia Dương Thị Bạch Diệp vướng vòng lao lý, doanh nghiệp bị vận đen đeo bám","Trong khi nữ đại gia Dương Thị Bạch Diệp bị khởi tố, công ty TNHH Bất động sản Diệp Bạch Dương do nữ đại gia này làm người đại diện pháp luật vẫn tiếp tục bị vận đen đeo bám.",22-04-2019,"['truy thu thuế', 'Dương Thị Bạch Diệp', 'nợ thuế']"
659184,Ô tô - Xe máy,MG vẫn tăng trưởng mạnh ở Anh khi các hãng khác điêu đứng vì Covid-19,"Ông Mike Rutherford, nhà báo kỳ cựu, người đồng sáng lập tạp chí Auto Express đã phân tích lý do tại sao hãng xe MG phát triển và tăng trưởng mạnh tại Anh trong thời kỳ Covid-19.",20-07-2020,"['MG', 'Morris Garages']"
611599,Kinh Doanh,"Lo nhiễm virus corona, xuyên Tết tìm mua khẩu trang phòng bệnh","Người dân bất an, nháo nhào tìm mua khẩu trang để phòng chống bệnh viêm phổi cấp do virus corona mới. Trên mạng xã hội nhiều người bắt đầu rao bán khẩu trang chống virus, một số đầu mối còn tranh thủ bán hàng xuyên Tết.",24-01-2020,"['bệnh viêm phổi', 'khẩu trang', 'virus corona']"
611691,Kinh Doanh,"Mua đồ cầu lộc gặp ngay hàng giả, cú lừa đau ngày Tết","Mua quả thắp hương còn nguyên lá với quan niệm lộc lá đầy đủ, cầu mong làm ăn được thuận lợi, không ngờ dính kẻ xấu dính kéo 502 làm đồ giả lừa người mua",25-01-2020,"['hoa tết', 'thú cưng', 'dịch vụ ngày Tết', 'gà quý', 'khẩu trang']"
629256,Ô tô - Xe máy,Trung tâm triển lãm ô tô tại Detroit thành bệnh viện dã chiến,Triển lãm ô tô quốc tế Bắc Mỹ Detroit (NAIAS) - “cửa ngõ” của nhiều nhà sản xuất ô tô danh tiếng trên thế giới là nạn nhân tiếp theo của dịch Covid-19 sau khi ban tổ chức tuyên bố hủy bỏ sự kiện này.,30-03-2020,"['công nghiệp ô tô', 'Triển lãm ô tô quốc tế', 'Ford', 'COVID-19', 'virus corona']"
611666,Kinh Doanh,Loài hồng trà độc nhất vô nhị trên thế giới ở Yók Đôn,"Các chuyên gia nước ngoài xác định hồng trà ở Vườn Quốc gia Yók Đôn là loài đặc hữu cực kỳ quý hiếm, chưa từng phát hiện trên thế giới.",25-01-2020,['trà quý']
614953,Kinh Doanh,"Giàn phong lan giả hạc thanh củi ""khủng"" của 9X Lâm Đồng","Chàng trai Vũ Đức Nghi chụp ảnh bên những giò hoa lan giả hạc thanh củi khiến ai nhìn thấy cũng thấy “choáng“ và mong ước sở hữu cho riêng mình dù chỉ một phần nhỏ của những giò lan giả hạc “độc, lạ“ và “khủng“ hiếm thấy này.",09-02-2020,"['lan giả hạc', 'hoa lan', 'lan quý']"
571825,Kinh Doanh,'Đột nhập' vườn lan rộng 2ha cả trăm loại 'vạn người mê' ở Hòa Bình,"Ít ai ngờ ở miền núi Lương Sơn, Hòa Bình lại có một trang trại rộng gần 2 ha trồng hoa lan với hàng trăm chủng loại, từ bình dân đến đắt tiền.",27-09-2019,"['lan quý', 'hoa lan', 'hòa bình']"
620341,Ô tô - Xe máy,"Nhân viên nhiễm Covid-19, Hyundai đóng cửa nhà máy tại Hàn Quốc","Tập đoàn Hyundai Motors đã quyết định ngừng hoạt động sản xuất nhà máy tại khu công nghiệp Ulsan, Hàn Quốc sau khi một nhân viên của hãng được xác nhận nhiễm Covid-19.",29-02-2020,"['bệnh dịch Trung Quốc', 'Hyundai', 'virus corona', 'nCoV', 'COVID-19', 'Virus viêm phổi Vũ Hán', 'công nghiệp ô tô']"
618238,Ô tô - Xe máy,Nhật Bản lập liên minh ô tô nhằm đối phó với dịch Covid-19,"Nhật Bản sẽ lập ra một nhóm bao gồm chính phủ, các nhà sản xuất ô tô và các nhà cung ứng trong nước để tìm ra những giải pháp kịp thời nhằm giảm thiểu tác động của COVID-19 lên ngành công nghiệp ô tô nước nhà.",21-02-2020,"['đại dịch viêm phổi', 'virus corona', 'liên minh ô tô', 'ô tô nhật bản', 'công nghiệp ô tô', 'nCoV']"
505591,Kinh Doanh,Đại gia Dương Thị Bạch Diệp: Từ tay trắng đến đại gia và tù tội,"Mấy ngày qua, dư luận xôn xao vì  nữ đại gia Dương Thị Bạch Diệp bị bắt về tội lừa đảo.",29-01-2019,"['Dương Thị Bạch Diệp', 'nữ đại gia']"
649871,Ô tô - Xe máy,TMT Motors ưu đãi 'cực lớn' hậu dịch Covid-19,"TMT Motors hợp tác cùng Ngân hàng VPBank triển khai chương trình kích cầu khủng hỗ trợ khách hàng là cá nhân, tổ chức vay vốn đến 70% giá trị xe đến 31/12/2020.",18-06-2020,"['xe ben', 'xe tải']"
618654,Ô tô - Xe máy,Jaguar Land Rover có thể phải ngừng sản xuất tại Anh vì dịch Covid-19,Jaguar Land Rover có thể sẽ buộc phải đóng cửa các nhà máy tại Anh do thiếu phụ tùng từ Trung Quốc - quốc gia đang chịu ảnh hưởng nặng nề từ dịch bệnh Covid-19.,23-02-2020,"['sản xuất ô tô', 'COVID-19', 'Jaguar Land Rover', 'virus corona']"
620342,Ô tô - Xe máy,"Doanh số ô tô toàn cầu dự đoán giảm 2,5% do Covid-19",Ảnh hưởng của virus corona lên nền công nghiệp ô tô toàn cầu đang dần trở nên đáng báo động trong thời gian qua.,29-02-2020,"['Virus viêm phổi Vũ Hán', 'virus corona', 'SAR - CoV 2', 'công nghiệp ô tô', 'nCoV']"
620942,Ô tô - Xe máy,Hoãn chặng đua đua MotoGP đầu tiên tại Qatar vì dịch Covid-19,"Do diễn biến phức tạp của dịch bệnh, cộng thêm Qatar phải hạn chế tiếp nhận các chuyến bay, đặc biệt là từ Italy, nên chặng đua mở màn mùa giải MotoGP năm nay - Grand Prix of Qatar phải hoãn lại.",02-03-2020,"['đua xe mô tô', 'đua xe']"
649282,Ô tô - Xe máy,"Ô tô giảm giá cả trăm triệu, thị trường xe tăng trưởng mạnh sau Covid-19","Doanh số xe bán được trong tháng 5/2020 tăng 62% so với tháng trước, trong bối cảnh các hãng ô tô giảm giá, xả hàng để kích cầu cũng như chuẩn bị đón loạt xe mới.",16-06-2020,"['ô tô giảm giá', 'Thị trường ô tô']"
538199,Kinh Doanh,"Từ giò phi điệp bạn cho, sau 4 năm làm nên vườn lan rừng tiền tỷ","Sau gần 4 năm xây dựng, anh Phạm Quốc Hưng (28 tuổi, trú khu 9, thị trấn Thanh Hà, huyện Thanh Hà, tỉnh Hải Dương) đang sở hữu một vườn lan rừng quy mô lớn, với nhiều chủng loại quý hiếm khác nhau.",03-06-2019,"['lan rừng', 'lan phi điệp', 'lan quý hiếm', 'hoa lan']"
618156,Ô tô - Xe máy,Honda Super Cub 1968 “biển tứ quý 6” rao giá 100 triệu gây xôn xao,"Chiếc Honda Super Cub 1986 đã 52 tuổi gắn biển số đẹp “tứ quý 6"" vừa được chủ nhân tại Tp HCM rao giá 100 triệu đồng gây sốt trong cộng đồng chơi xe máy.",21-02-2020,"['Honda Super Cub  giá khủng', 'Honda Super Cub biển tứ quý', 'Honda Super Cub độ khủng', 'Honda Super Cub']"
591300,Kinh Doanh,"Bát nháo thị trường trà hoa nở, hàng Tàu siêu rẻ bán tràn lan","Loại trà hoa nở trong nước đang được rao bán khá nhiều trên thị trường dịp cuối năm với đủ mức giá rẻ bất ngờ, tuy nhiên, không phải ai cũng chọn được sản phẩm ưng ý.",24-11-2019,['trà quý']
508551,Kinh Doanh,Tây Ninh: Vườn lan ‘quý tộc’ tiền tỷ của chàng thạc sĩ xây dựng,"Sau gần 6 năm khởi nghiệp từ vườn hoa lan hồ điệp, đến nay có thể khẳng định, định hướng khởi nghiệp của anh Dương Võ Đạt Chí, phường Hiệp Ninh, TP Tây Ninh, tỉnh Tây Ninh là đúng và đã thành công.",18-02-2019,"['lan hồ điệp', 'lan quý', 'hoa lan']"
544582,Kinh Doanh,Vườn lan phi điệp tím cổ thụ tiền tỷ nghìn vòi bung nở ở Tuyên Quang,"Tháng 6 cũng là dịp vườn Phi điệp của gia đình ông Bùi Văn Dũng, thôn Hàm Ếch, xã Thượng Ấm, huyện Sơn Dương (Tuyên Quang) nở tím rực rỡ cả một vùng trời.",25-06-2019,"['lan quý hiếm', 'an phi điệp', 'hoa lan', 'lan rừng']"
648508,Ô tô - Xe máy,"Xe bán tải bán chạy tháng 5, Ford Ranger giữ vững ngôi đầu","Phân khúc xe bán tải trong tháng 5 có sự tăng trưởng mạnh mẽ về doanh số đến 138,2% so với tháng trước. Trong đó, Ford Ranger vẫn giữ ngôi đầu, Mitsubishi Trion bứt phá lên đứng vị trí thứ 2 bảng xếp hạng.",13-06-2020,"['VAMA', 'xe bán tải', 'Thị trường ô tô']"
616012,Ô tô - Xe máy,Các hãng ô tô Trung Quốc lấn sân sản xuất khẩu trang chống dịch virus corona,"Dịch virus corona hoành hành khiến mặt hàng khẩu trang trở nên khan hiếm, nhiều nhà sản xuất ô tô và các công ty cung cấp năng lượng tại Trung Quốc đã quyết định trang bị thêm dây chuyền sản xuất khẩu trang.",13-02-2020,"['virus corona', 'nCoV']"
617079,Ô tô - Xe máy,Đại gia xây gara chứa 20 siêu xe và đường đua trong nhà riêng,"Ông trùm kinh doanh RV Don Wallace ở Florida sở hữu biệt thự 1,7 triệu USD gây chú ý với gara khủng có thể chứa trên 20 siêu xe và một đường đua riêng phục vụ sở thích đua xe bất cứ lúc nào.",17-02-2020,"['siêu xe', 'siêu xe khủng của đại gia', 'biệt thự triệu đô', 'Đại gia xây gara chứa 20 siêu xe']"
616379,Ô tô - Xe máy,"Nissan GT-R dùng làm xe quay phim, nhanh hơn cả xe đua","Chiếc xe thuộc sở hữu của Mauro Calo, một chuyên gia sản xuất video về ôtô có tiếng. Nhiều chi tiết trên xe được thay đổi để phục vụ cho việc quay phim.",14-02-2020,"['Nissan GT-R phiên bản xe quay phim chuyên dụng', 'xe đua', 'Nissan GT-R dùng làm xe quay phim', 'Nissan GT-R']"
648529,Ô tô - Xe máy,Giá ô tô cũ lao dốc trước khi phí trước bạ giảm 50%,"Ô tô mới liên tiếp giảm giá kết hợp thông tin giảm 50% phí trước bạ cho xe nội, khiến giới kinh doanh ô tô cũ như ngồi trên lửa.",12-06-2020,"['ô tô cũ', 'xe cũ', 'phí trước bạ']"
537971,Kinh Doanh,Giò lan siêu hiếm 'Người đẹp Bình Dương' được bán gần 10 tỷ,"Một giò phong lan phi điệp đột biến ""siêu hiếm"" có tên ""Người đẹp Bình Dương"" được chuyển giao cho một nhóm người chơi lan ở Thái Bình với giá gần 10 tỷ đồng đang gây xôn xao giới chơi lan.",02-06-2019,"['lan quý', 'lan phi điệp', 'lan đột biến', 'hoa lan']"
531981,Kinh Doanh,"2 chậu lan 3,5 tỷ: Cú áp phe có mục đích của nhóm người Hà Tĩnh?","Nhóm người Hà Tĩnh vừa ra tận Hải Phòng thực hiện cuộc giao dịch “sốc”mua 2 chậu lan quý với giá 3,5 tỷ đồng. Theo tìm hiểu, đây là cuộc giao dịch có nhiều chủ đích.",16-05-2019,"['lan quý', 'hoa lan', 'lan phi điệp']"
615725,Ô tô - Xe máy,Xe tay ga nữ giá 40 triệu: Chọn Yamaha Latte hay Honda Scoopy?,"Bỏ qua những lựa chọn phổ thông, Yamaha Latte và Honda Scoopy là 2 cái tên ít được nhắc đến mặc dù mỗi dòng xe đều có những điểm đáng chú ý.",12-02-2020,"['xe tay ga nhập khẩu', 'Honda Scoopy', 'xe tay ga nữ 40 triệu', 'Yamaha Latte', 'xe tay ga nữ', 'xe tay ga']"
648418,Ô tô - Xe máy,Chưa hề có doanh thu nhưng hãng xe điện này vẫn được định giá 23 tỷ USD,"Một hãng xe điện được thành lập từ năm 2014 và chưa có bất kỳ sản phẩm thương mại nào, nhưng vẫn có giá trị thị trường hơn 23 tỷ USD và có thời điểm vượt qua cả “ông lớn” Ford.",12-06-2020,"['nikola badger', 'Tesla', 'ô tô điện', 'xe bán tải', 'xe điện']"
539106,Kinh Doanh,"Giò lan phi điệp tiền tỷ chấn động, nghi vấn 1 cú lừa ngoạn mục","Không ít đại gia sẵn sàng bỏ ra hàng tỷ đồng để mua một giò lan phi điệp đột biến có màu sắc, hình dáng độc, lạ. Nhưng nhiều người nghi ngờ những thương vụ mua bán lan bạc tỷ này chỉ là chiêu thổi giá của giới buôn lan.",18-06-2019,"['lan phi điệp', 'hoa lan', 'lan quý hiếm', 'lan rừng']"
538431,Kinh Doanh,Nhóm đại gia Thái Bình chi 10 tỷ mua cây hoa phong lan: Lộ điểm ‘đáng nghi’,Một đại gia Thái Bình vừa chi ra 10 tỷ đồng để “rinh” về nhà cây hoa phong lan khiến dư luận xôn xao,04-06-2019,"['lan phi điệp', 'lan rừng', 'lan quý hiếm', 'hoa lan']"
533731,Kinh Doanh,Rùng rùng đi lùng mua mầm phong lan đột biến 7 tỷ,"Nhiều người đang kinh doanh bất động sản, sim số đẹp bỗng chuyển hướng sang “săn” lan đột biến. Giới chơi lan càn quét các cánh rừng để lùng lan đột biến.",22-05-2019,"['lan phi điệp', 'lan quý', 'lan đột biến', 'hoa lan']"
648151,Ô tô - Xe máy,10 xe bán chạy nhất tháng 5: VinFast Fadil đánh bại Hyundai Grand i10,"Top 10 xe bán chạy nhất tháng 5 có sự thay đổi khá rõ rệt giữa các vị trí xếp hạng. Trong đó, 3 mẫu xe Kia Soluto, Toyota Fortuner, Mazda CX-5 trượt top, VinFast lần đầu tiên góp mặt với hai đại diện là Fadil và Lux A2.0.",11-06-2020,"['Ford', 'Thị trường ô tô', 'Mazda', 'Toyota', 'VAMA', 'Hyundai', 'honda', 'mitsubishi', 'Vinfast']"
648463,Ô tô - Xe máy,Công bố nguyên nhân và khuyến cáo người dùng vụ xe Ford chảy dầu,"Sau hơn 3 tháng tiếp nhận vụ việc chảy dầu trên xe Ranger, Raptor, Everest của Ford, Cục Cạnh tranh và Bảo vệ Người tiêu dùng vừa công bố nguyên nhân và đưa ra khuyến cáo đến khách hàng về vấn đề này.",12-06-2020,"['Ford Ranger', 'Ford Raptor', 'triệu hồi xe', 'lỗi xe Ford', 'Ford', 'xe Ford chảy dầu', 'Ford Everest']"
612637,Ô tô - Xe máy,Dán nhãn năng lượng xe máy kích hoạt cuộc đua tiết kiệm nhiên liệu?,"Từ ngày 1/1/2020, các mẫu xe máy tại Việt Nam trước khi bán ra thị trường đều phải dãn nhãn năng lượng, công bố mức tiêu hao nhiên liệu. Hiện đã có gần 200 mẫu xe máy công bố mức tiêu hao nhiên liệu.",31-01-2020,"['xe tiết kiệm nhiên liệu', 'dán nhãn năng lượng ô tô xe máy']"
648265,Ô tô - Xe máy,Top 10 xe ô tô ế ẩm nhất tháng 5: Xe Nhật chiếm đa số,"Trong danh sách top 10 ô tô ế ẩm nhất tháng 5/2020, có đến 9 mẫu xe đến từ các thương hiệu xe Nhật. Trong đó, Honda, Suzuki, Toyota, Isuzu chia đều mỗi hãng góp mặt hai mẫu xe.",12-06-2020,"['ô tô ế ẩm', 'xe nhật']"
602061,Ô tô - Xe máy,Ngắm “bán tải 3 bánh”  Honda AirBlade của dân chơi Bình Định,"Từ một chiếc xe tay ga phổ thông là Honda AirBlade, người thợ ở Bình Định đã tạo nên một mẫu xe ba bánh độc đáo dùng để chuyên chở người tàn tật cùng xe lăn.",21-12-2019,"['Honda AirBlade', 'xe ba bánh độ từ Honda AirBlade']"
645678,Ô tô - Xe máy,"Mua xe ""găm lại"" đợi giảm phí trước bạ: Có bị phạt quá hạn đăng ký?","Sợ khi phí trước bạ giảm thì giá xe lại tăng, nhiều người tiêu dùng có ý tưởng liều mua xe luôn và ""găm lại"", chờ khi phí trước bạ giảm mới đi đăng ký...",02-06-2020,['lệ phí trước bạ']
645971,Ô tô - Xe máy,Đại lý ô tô vắng hoe vì khách chờ giảm phí trước bạ,"Nhiều khách hàng có tâm lý chờ đợi giảm phí trước bạ 50% để mua xe khiến nhiều đại lý ô tô rơi vào cảnh đìu hiu, vắng khách.",03-06-2020,"['ế ẩm', 'lệ phí trước bạ', 'đại lý ô tô']"
504940,Kinh Doanh,Bốn ngày buôn lan lỗ cả ngàn USD: Vụ Tết nhớ đời của anh trai công sở,"Tết năm ngoái, tôi cũng bắt chước chị em đi buôn lan hồ điệp để kiếm thêm ít tiền tiêu Tết. Thế nhưng, bỏ cả việc để đi buôn trong vòng 4 ngày Tết, tôi lỗ mất hơn 26 triệu đồng.",28-01-2019,"['kiếm tiền tiêu Tết', 'Tết nguyên đán']"
645818,Ô tô - Xe máy,"Loạt xe trong nước sắp ra mắt, kịp hưởng lợi giảm 50% phí trước bạ","Mitsubishi Xpander, Peugeot 508, Kia Seltos, Kia Sorento...thế hệ mới 2020 là những mẫu xe lắp ráp trong nước đang dần bước vào giai đoạn chuẩn bị để ra mắt khách hàng Việt Nam trong năm nay để kịp đón đợt hỗ trợ 50% thuế trước bạ.",03-06-2020,"['xe lắp ráp trong nước', 'xe mới', 'lệ phí trước bạ']"
645541,Ô tô - Xe máy,"Chơi xe sang cũ, toát mồ hôi vì phí sửa ngốn cả tỷ đồng","Chiếc Audi cũ có giá 1,6 tỷ đồng, khi vào xưởng nhận hóa đơn báo giá chi phí sửa hơn 1,2 tỷ đồng khiến chủ nhân sốc.",02-06-2020,"['xe sang giá mềm', 'sửa xe sang', 'xe sang', 'ô tô sang sửa tiền tỷ', 'sửa xe tiền tỷ']"
624637,Ô tô - Xe máy,"Một thời bán ""bia kèm lạc”, xe hot đời 2019 đua nhau hạ giá","Trong bối cảnh giá xe đi xuống trên toàn thị trường, nhiều mẫu xe ăn khách, thường xuyên bán chênh giá, bán “bia kèm lạc” như Toyota Camry, Toyota Rush, Ford EcoSport… hiện cũng đang được điều chỉnh giảm khá mạnh để hút khách mua.",17-03-2020,"['Toyota Camry', 'xe bán bia kèm lạc', 'xe giảm giá', 'giảm giá xe']"
646798,Ô tô - Xe máy,"Ô tô nhập khẩu chịu những loại thuế, phí nào?","Các mẫu xe nhập khẩu hiện đang phải chịu 3 loại thuế cơ bản bao gồm: thuế VAT, thuế tiêu thụ đặc biệt, thuế nhập khẩu và một số loại phí khác.",05-06-2020,"['thuế nhập khẩu ô tô', 'thuế ô tô', 'thuế tiêu thụ đặc biệt ô tô', 'phí trước bạ ô tô']"
638482,Ô tô - Xe máy,Xe điện Tesla độc nhất có giá gần 250.000 USD,"Tại châu Âu, mẫu xe Tesla Model S độc nhất vô nhị có giá 245.810 USD. Tại các thị trường khác, khách mua chỉ phải trả 203.150 USD.",04-05-2020,"['xe điện Tesla', 'xe điện', 'Tesla']"
612329,Ô tô - Xe máy,Xe BMW chạy hydro có giá rẻ như xe chạy xăng vào năm 2025,"Các dòng xe chạy pin nhiên liệu hydro của BMW trong tương lai tới đây sẽ có mức giá thấp hơn, thậm chí là ngang bằng với giá xe sử dụng động cơ đốt trong nhờ nền tảng công nghệ mới đang được nghiên cứu.",30-01-2020,"['xe chạy hydro', 'xe BMW', 'xe thông minh']"
640948,Ô tô - Xe máy,"Siêu xe điện Kia Imagine, sạc 20 phút, tăng tốc nhanh hơn siêu xe","Theo nhà sản xuất, Kia Imagine có khả năng tăng tốc từ 0-62 mph (0-100 km/h) trong vòng chưa đầy 3 giây, cùng quãng đường di chuyển 483 km trên một lần sạc.",14-05-2020,"['siêu xe', 'xe điện', 'Kia']"
623073,Ô tô - Xe máy,"10 xe hot nhất tháng 2: Toyota Vios tăng mạnh, Xpander dậm chân tại chỗ","Top 10 xe bán chạy nhất Việt Nam trong tháng 2 có khá nhiều biến động. Toyota Vios tăng khủng dành lại vị thế ngôi vương, Hyundai là SantaFe và Tucson nhường chỗ cho sự quay trở lại của Toyota Innova và Ford Ranger.",10-03-2020,"['top 10 xe bán chạy nhất', 'xe bán chạy nhất thị trường', 'VAMA', 'thị trường xe', 'Toyota Vios', 'xe ô tô']"
641312,Ô tô - Xe máy,Dàn xe điện Tesla giá gần 70 tỷ đồng của cảnh sát Thái Lan gây sốt,Chính phủ Thái Lan vừa đầu tư khoảng tiền gần 3 triệu đô tương đương hơn 70 tỷ đồng để đầu tư dàn xe cảnh sát mới và sử dụng động cơ điện hoàn toàn Tesla Model 3.,15-05-2020,"['Tesla', 'xe điện', 'Xe Thái Lan', 'xe cảnh sát']"
641760,Ô tô - Xe máy,"Đỉnh cao xe điện, pin chạy hàng triệu km mới hết hạn","Một loại pin ô tô điện mới vừa được Tesla nghiên cứu và dự kiến sản xuất tại Trung Quốc với giá thành sản xuất rẻ nhưng tuổi thọ lại cực bền, có thể vận hành hàng triệu km mới hết hạn, thay vì chỉ khoảng 160.000km hiện nay.",17-05-2020,"['xe Tesla', 'Tesla', 'xe điện', 'ô tô điện', 'pin xe điện']"
612097,Ô tô - Xe máy,Thiếu niên 14 tuổi chế tạo xe đạp chạy bằng xăng,Một thiếu niên 14 tuổi tại Ấn Độ đã khiến không ít người phải trầm trồ thán phục khi chế tạo chiếc xe đạp tích hợp động cơ đốt trong.,28-01-2020,['xe đạp chạy bằng xăng']
