id,cate,title,lead,time,tag622062,Sức khỏe,"Ca đẻ đặc biệt tại phòng cách ly: Thai phụ đeo khẩu trang đi trước, xịt khuẩn theo sau","- Thai phụ trở dạ trong thời gian cách ly tập trung ngừa Covid-19, để đảm bảo an toàn cho ca mổ đẻ, mọi phương án đều phải tính toán vô cùng tỉ mỉ.",06-03-2020,"['COVID-19', 'virus corona']"
620463,Thế giới,Hàn Quốc phát hiện bệnh nhân Covid-19 đầu tiên tái nhiễm sau điều trị,"Nhà chức trách Hàn Quốc thông báo vừa phát hiện trường hợp tái nhiễm virus corona chủng mới đầu tiên ở bệnh nhân đã hồi phục, giữa lúc ngày càng có nhiều quan ngại về tình hình dịch Covid-19 tại nước này.",29-02-2020,"['Hàn Quố', 'Virus viêm phổi Vũ Hán', 'COVID-19', 'Virus viêm phổi', 'virus corona']"
510910,Thế giới,Hành động gây tranh cãi của bà mẹ có con trai nghiện game,Video ghi lại hành động đáng kinh ngạc của một bà mẹ dành cho cậu con trai nghiện trò chơi điện tử (game) đang được chia sẻ chóng mặt trên mạng và làm dấy lên một cuộc tranh cãi nảy lửa.,04-03-2019,"['nghiện game', 'nghiện điện tử']"
621477,Thế giới,Người biểu tình đảo Réunion tấn công du thuyền vì sợ Covid-19,Cảnh sát đã phải sử dụng đến hơi cay để khống chế những người biểu tình cực đoan trên đảo Réunion thuộc Pháp.,04-03-2020,"['Virus viêm phổi', 'virus corona', 'COVID-19', 'Trung Quốc']"
622231,Sức khỏe,Hà Nội phun khử khuẩn BV Hồng Ngọc sau ca nhiễm Covid-19 thứ 17,"Ca thứ 17 nhiễm Covid-19 tại Việt Nam từng đến BV Hồng Ngọc khám bệnh. Hà Nội đã phun khử khuẩn toàn bộ bệnh viện và cách ly 18 y bác sĩ, nhân viên bệnh viện.",07-03-2020,"['Virus viêm phổi', 'virus corona', 'COVID-19', 'viêm phổi cấp']"
509573,Thế giới,Ngày này năm xưa: Bức ảnh biểu tượng của Thế chiến II ra đời,Một trong những bức ảnh nổi tiếng nhất trong Thế chiến II được chụp vào ngày 23/2/1945 khi quân Mỹ kéo cờ trên hòn đảo Iwo Jima ở Thái Bình Dương.,23-02-2019,"['bức ảnh', 'Thế chiến II', 'Ngày này năm xưa']"
511095,Thế giới,Căng thẳng Ấn Độ-Pakistan hạ nhiệt,"Đoạn video đầu tiên về phi công Ấn Độ Abhinandan Varthaman băng qua biên giới và trở về đất nước sau khi được Pakistan thả, đã được công bố rộng rãi.",02-03-2019,"['căng thẳng hạ nhiệt', 'Ấn Độ', 'Pakistan', 'căng thẳng']"
510727,Thế giới,Ngày này năm xưa: Diễn viên da đen đầu tiên nhận giải Oscar,"Nữ diễn viên Hattie McDaniel, thủ vai Mammy trong bộ phim Cuốn theo chiều gió là người da đen đầu tiên nhận tượng vàng danh giá Oscar.",01-03-2019,"['Hattie McDaniel', 'Ngày này năm xưa', 'Diễn viên da đen', 'giải Oscar']"
505832,Thế giới,Điều khiến Huawei rơi vào 'cát lún',Tập đoàn viễn thông hàng đầu Trung Quốc Huawei đang trở thành tâm điểm căng thẳng ngày càng gia tăng giữa Bắc Kinh và Washington.,30-01-2019,"['Mạnh Vãn Chu', 'công chúa Huawei', 'tập đoàn viễn thông Huawei', 'Huawei', 'Trung Quốc']"
621691,Thế giới,Bệnh nhân TQ nhiễm Covid-19 tử vong sau 5 ngày xuất viện,Người đàn ông trên đã tử vong vì suy hô hấp chỉ vài ngày sau khi được xuất viện.,05-03-2020,"['Trung Quốc', 'COVID-19', 'virus corona']"
617457,Thế giới,Hong Kong khởi tố 2 người trốn cách ly Covid-19,Hong Kong (Trung Quốc) vừa thông báo sẽ tiến hành khởi tố hai người vì vi phạm các quy định cách ly bắt buộc giữa đại dịch Covid-19.,18-02-2020,"['virus corona', 'Virus viêm phổi', 'Hồng Kông', 'Trung Quốc', 'COVID-19']"
617542,Thế giới,"Không đeo khẩu trang chống Covid-19, kẻ cứng đầu bị trói vào cột nhà","Một nông dân ở tỉnh Hà Nam, Trung Quốc đã bị các nhân viên y tế mặc đồ chống chất nguy hiểm trói vào cột nhà vì không chịu đeo khẩu trang khi ra ngoài.",18-02-2020,"['khẩu trang', 'COVID-19', 'Virus viêm phổi Vũ Hán', 'virus corona']"
617441,Thế giới,Hàn Quốc cảnh báo 'tình trạng khẩn cấp' kinh tế vì Covid-19,Seoul rung hồi chuông cảnh báo một ngày sau khi giới phân tích cho rằng một cuộc suy thoái kinh tế có nguy cơ ập đến Nhật Bản.,18-02-2020,"['Hàn Quốc', 'Trung Quốc', 'Virus viêm phổi', 'COVID-19', 'virus corona']"
622218,Thời sự,Bộ trưởng Tô Lâm khen 2 Thiếu úy hoãn đám cưới để chống dịch Covid-19,"Ngày 6/3, Bộ trưởng Tô Lâm gửi thư khen Công an tỉnh Vĩnh Phúc, Công an huyện Bình Xuyên và 2 cán bộ Đội Quản lý hành chính, Công an huyện Bình Xuyên, Công an tỉnh Vĩnh Phúc đã có thành tích trong công tác phòng, chống dịch bệnh Covid-19.",07-03-2020,"['virus corona', 'COVID-19', 'Vĩnh Phúc', 'công an']"
617344,Thế giới,WHO thông báo tín hiệu lạc quan về đại dịch Covid-19,"Chủng virus corona mới, gọi là Covid-19, chỉ gây bệnh nhẹ với 80% số người bị lây nhiễm, Tổ chức Y tế thế giới (WHO) cho biết.",18-02-2020,"['virus corona', 'dịch viêm hổi']"
621755,Thời sự,Cô gái về từ Hàn Quốc ở chung cư Sài Gòn xin cách ly tập trung,"Cô gái 21 tuổi từ Hàn Quốc trở về thuộc diện cách ly, theo dõi Covid - 19 sinh sống trong chung cư ở Sài Gòn đã đến điểm cách ly tập trung.",06-03-2020,"['virus corona', 'COVID-19']"
620430,Thế giới,Mỹ đột ngột hoãn đăng cai hội nghị ASEAN vì dịch Covid-19,"Hai quan chức Mỹ tiết lộ, chính quyền Tổng thống Donald Trump đã hoãn tổ chức một hội nghị thượng đỉnh với các nhà lãnh đạo Đông Nam Á ở Las Vegas trước những lo ngại ngày càng tăng về dịch Covid-19.",29-02-2020,"['Virus viêm phổi', 'virus corona', 'Virus viêm phổi Vũ Hán', 'Mỹ', 'Trung Quốc', 'COVID-19', 'Donald Trump']"
620360,Thế giới,"Thế giới điêu đứng vì Covid-19, WHO nâng nguy cơ dịch lên mức cao nhất","Tổ chức Y tế thế giới (WHO) đã nâng mức đánh giá rủi ro toàn cầu vì dịch Covid-19 lên mức cao nhất trong bối cảnh virus corona chủng mới tiếp tục lây lan nhanh và mạnh khắp các châu lục, ngoại trừ Nam cực.",29-02-2020,"['COVID-19', 'Mỹ', 'Virus viêm phổi', 'virus corona', 'Trung Quốc', 'Virus viêm phổi Vũ Hán', 'Iran', 'Hàn Quốc']"
509479,Thế giới,Nhà cái gây sốc vì vụ cá cược lạ lùng về Putin,Một nhà cái Kazakhstan gây sốc khi mở cá cược liệu nữ vô địch quyền Anh thế giới của nước này sẽ mời Tổng thống Nga Putin giao đấu hay chụp khỏa thân cho tạp chí người lớn Playboy.,22-02-2019,"['Kazakhstan', 'Putin', 'vô địch quyền Anh']"
507585,Thế giới,Lái xe chở tiền biến mất bí ẩn cùng 1 triệu Euro,"Các nguồn tin cảnh sát Pháp tiết lộ, tài xế điều khiển một chiếc xe bọc thép chuyên chở tiền ở ngoại ô thủ đô Paris đã biến mất cùng số tiền ước tính tới 1 triệu Euro.",12-02-2019,"['xe chở tiền', 'Pháp', 'trộm tiền', 'vụ trộm táo tợn']"
617213,Thế giới,"Ngôi làng 'cứng' nhất Vũ Hán, ở tâm dịch cả làng không ai bị bệnh","Làng Lâm Cảng, trấn Giang Hạ, thành phố Vũ Hán, tỉnh Hồ Bắc có 3000 nhân khẩu. Tính đến nay, trong làng chưa có 1 người nào bị nhiễm Covid-19.",18-02-2020,"['Virus viêm phổi', 'Trung Quốc', 'virus corona', 'COVID-19']"
510862,Thế giới,"Pakistan thả phi công, Ấn Độ vui mừng 'tột bậc'","Thủ tướng Pakistan Imran Khan thông báo nước này sẽ thả viên phi công đã bắt giữ của Ấn Độ như một ""cử chỉ hòa bình"".",01-03-2019,"['Ấn Độ', 'chiến tranh', 'Pakistan']"
621650,Sức khỏe,Bộ Y tế cấp phép sản xuất 2 bộ kit xét nghiệm Covid-19,- Bộ Y tế quyết định cấp số đăng ký tạm thời cho 2 sinh phẩm test kit xét nghiệm virus corona mới để đưa vào sản xuất hàng loạt.,05-03-2020,"['Virus viêm phổi', 'COVID-19', 'viêm phổi cấp', 'virus corona']"
510480,Thế giới,Ngày này năm xưa: Thủ tướng Thụy Điển bị ám sát,"Ngày 28/2/1986, Thủ tướng Thụy Điển Olof Palme đã bị một tay súng tấn công khi đang cùng vợ đi bộ từ rạp chiếu phim về nhà.",28-02-2019,"['Thụy Điển', 'Thủ tướng', 'ám sát']"
508924,Thế giới,Ngắm nội thất độc đáo trong siêu xe bọc thép của Putin,"Kênh Zvezda vừa công bố đoạn video hiếm hoi hé lộ nội thất độc đáo của một chiếc limousine Aurus Senat, mẫu siêu xe bọc thép Tổng thống Nga Vladimir Putin đang dùng.",19-02-2019,"['Nga', 'Putin', 'limousine Aurus Senat']"
613517,Thế giới,"Hong Kong ""chặn cửa"" qua lại với đại lục vì virus corona",Trưởng đặc khu hành chính Hong Kong (Trung Quốc) Carrie Lam vừa tuyên bố phong tỏa hầu hết các tuyến đường qua lại với đại lục để ngăn chặn sự lây lan của dịch do virus corona mới (2019-nCoV hay virus Vũ Hán) gây ra.,03-02-2020,"['Virus viêm phổi', 'virus corona', 'Hồng Kông', 'Trung Quốc']"
617490,Thế giới,Cướp có vũ trang lấy đi hàng trăm cuộn giấy vệ sinh,"Những kẻ cướp có vũ trang đã lấy đi hàng trăm cuộn giấy vệ sinh trị giá hơn 1.000 đôla Hong Kong, khoảng 3 triệu đồng.",18-02-2020,"['Hồng Kông', 'giấy vệ sinh']"
622046,Thời sự,Khai báo y tế bắt buộc mọi hành khách nhập cảnh vào Việt Nam từ 7/3,"Từ 6 giờ sáng 7/3, mọi hành khách nhập cảnh vào Việt Nam phải thực hiện khai báo y tế bắt buộc.",06-03-2020,"['COVID-19', 'virus corona']"
617338,Thế giới,Tòa án Nga buộc người trốn lệnh cách ly Covid-19 trở lại bệnh viện,"Cơ quan luật pháp Nga đã buộc cô Alla Ilyina phải quay trở lại khu cách ly virus Covid-19, sau khi cô này trốn khỏi một trạm y tế trong thành phố Saint Petersburg, Nga hồi tuần trước.",18-02-2020,"['Virus viêm phổi', 'Virus viêm phổi Vũ Hán', 'virus corona', 'Trung Quốc', 'COVID-19']"
621929,Thời sự,Bác sỹ công an kiêm shipper trong khu cách ly dịch Covid-19,"Chốc chốc phòng hành chính, Khoa nội Tổng hợp ở tầng 4 BV Công an TP Hà Nội lại vang lên tiếng anh bảo vệ từ bộ đàm “có người nhà gửi đồ lên phòng cách ly”, “chuẩn bị đón người cách ly”…, các BS lại tất tả chạy đi.",06-03-2020,"['COVID-19', 'virus corona']"
616960,Thế giới,Thêm 100 người thiệt mạng trong một ngày vì Covid-19,"Tính đến sáng nay (17/2), số người tử vong vì virus corona trên toàn cầu đã lên tới 1.770 khi tỉnh Hồ Bắc, Trung Quốc, thông báo có thêm 1.933 ca nhiễm mới và có thêm 100 người chết.",17-02-2020,"['COVID-19', 'virus gây viêm phổi', 'virus corona', 'Trung Quốc']"
617359,Thế giới,Mỹ đưa 14 công dân nhiễm Covid-19 về nước,14 người trong số các công dân Mỹ được chở về nước từ du thuyền Nhật Bản Diamond Princess đã được chẩn đoán dương tính với virus corona chủng mới – tuyên bố chung của Bộ Ngoại giao và Bộ Y tế và Dịch vụ Nhân sinh Mỹ cho biết.,18-02-2020,"['Trung Quốc', 'Virus viêm phổi', 'COVID-19', 'virus corona']"
506028,Thế giới,Tổng thống Venezuela kêu gọi người Mỹ chống ông Trump,"Trong thông điệp trực tiếp đầu tiên gửi người dân Mỹ, Tổng thống Venezuela Nicolas Maduro kêu gọi họ ngăn chặn chính quyền Donald Trump can thiệp vào nước này.",31-01-2019,"['Venezuela', 'Mỹ', 'Donald Trump', 'khủng hoảng chính trị']"
505707,Thế giới,Kết cục bất ngờ cho kẻ nuốt trộm nhẫn kim cương gần 1 tỷ,Người đàn ông Ireland cố tình nuốt chửng chiếc nhẫn kim cương đắt tiền tại một cửa hàng bán đồ trang sức ở Thổ Nhĩ Kỳ không thể ngờ những gì phải trải qua sau đó.,30-01-2019,"['ăn trộm', 'hy hữu', 'Ireland', 'nhẫn kim cương', 'Thổ Nhĩ Kỳ']"
620177,Thế giới,Thế giới chuẩn bị cho tình huống Covid-19 thành đại dịch,Hy vọng kìm chân virus corona chủng mới tại Trung Quốc đã mờ dần khi hàng loạt ca nhiễm mới được phát hiện ở nhiều quốc gia trên thế giới.,28-02-2020,"['COVID-19', 'virus corona']"
509055,Thế giới,"Malaysia tuyên bố hủy dự án, TQ vội hạ giá","Ngoại trưởng Malaysia cho hay, Trung Quốc sẵn sàng hạ giá dự án đường sắt nối liền bờ đông nước này tới 20 tỉ USD sau khi Thủ tướng Mahathir Mohamad tuyên bố sẽ hủy bỏ.",20-02-2019,"['Trung Quốc', 'Malaysia', 'Dự án đường sắt']"
613242,Thế giới,Xem Trung Quốc xây bệnh viện 'thần tốc' điều trị virus corona,"Bệnh viện Hỏa Thần Sơn chuyên chữa trị cho những người nhiễm virus corona ở Vũ Hán, Trung Quốc, sẽ bắt đầu hoạt động từ 3/2.",02-02-2020,"['virus corona', 'Virus viêm phổi', 'Trung Quốc']"
509634,Thế giới,Thế giới 24h: Pakistan cảnh cáo Ấn Độ,"Quân đội Pakistan cảnh báo sẵn sàng phòng vệ trước bất kỳ cuộc tấn công nào của Ấn Độ và sẽ đáp trả ""tổng lực"".",23-02-2019,"['Pakistan', 'Nga', 'Mỹ', 'cảnh báo', 'Nhật Bản', 'Ấn Độ']"
510719,Thế giới,Hàng ngàn khách kẹt tại sân bay Thái vì căng thẳng Ấn Độ-Pakistan,Hàng ngàn hành khách đã bị mắc kẹt tại sân bay Thái Lan sau khi Pakistan đóng cửa không phận giữa lúc căng thẳng với Ấn Độ gia tăng.,28-02-2019,"['mắc kẹt', 'hàng không', 'Hành khách']"
508507,Thế giới,Ngày này năm xưa: Tài xế chán đời gây thảm kịch kinh hoàng,"Ngày 18/2/2003, một người đàn ông đã đốt thùng chứa đầy xăng trên một chuyến tàu điện ngầm ở Daegu, Hàn Quốc, khiến gần 200 người chết và 150 người khác bị thương.",18-02-2019,"['tàu điện ngầm', 'Hàn Quốc', 'phóng hỏa', 'thảm họa', 'Hỏa hoạn']"
621524,Sức khỏe,WHO khuyến cáo 6 việc quan trọng với dân công sở để tránh Covid-19,"- WHO khuyến cáo các cơ quan thúc đẩy làm việc từ xa trong mùa dịch, vừa đảm bảo duy trì hoạt động, vừa đảm bảo sự an toàn của nhân viên.",05-03-2020,"['viêm phổi cấp', 'virus corona', 'COVID-19', 'Virus viêm phổi']"
508697,Thế giới,"Căng thẳng vụ tàu chiến, Bộ trưởng Anh hủy thăm TQ",Bộ trưởng Tài chính Anh phải hủy công du Trung Quốc một ngày sau khi Bắc Kinh nổi giận với kế hoạch điều hàng không mẫu hạm tới châu Á - Thái Bình Dương của London.,18-02-2019,"['Trung Quốc', 'Anh', 'hàng không mẫu hạm', 'Biển Đông', 'tàu chiến']"
616821,Thế giới,Thêm 139 bệnh nhân Covid-19 chết ở Hồ Bắc,"Tính đến hết ngày 15/2, tỉnh Hồ Bắc của Trung Quốc có thêm 139 bệnh nhân Covid-19 tử vong và 1.843 ca nhiễm mới trong vòng 24 giờ.",16-02-2020,"['Trung Quốc', 'Virus viêm phổi', 'COVID-19', 'virus corona']"
621426,Sức khỏe,"Sau bữa tiệc, nam thanh niên nguy kịch vì ăn so biển","- Vừa ăn được vài miếng trứng so biển, anh Tài đột nhiên thấy tay, chân và toàn bộ mặt tê bì, miệng nôn thốc rồi nhanh chóng suy hô hấp nặng.",04-03-2020,"['Ngộ độc thực phẩm', 'ngộ độc']"
620087,Thế giới,Số ca nhiễm mới Covid-19 ở Trung Quốc giảm mạnh,"Trong 24 giờ qua, Trung Quốc có thêm 44 ca tử vong và 327 ca nhiễm mới dịch Covid-19.",28-02-2020,"['virus corona', 'COVID-19']"
613489,Thế giới,Trung Quốc nói Mỹ 'phản ứng thái quá' về virus corona,"Phát ngôn viên Bộ Ngoại giao Trung Quốc Hoa Xuân Oánh nói rằng một số quốc gia, đặc biệt là Mỹ, đã phản ứng thái quá trước tình hình dịch bệnh do virus corona gây ra.",03-02-2020,"['virus corona', 'Trung Quốc', 'Virus viêm phổi', 'Mỹ']"
612732,Thế giới,Kinh tế Trung Quốc ‘bầm dập’ do dịch viêm phổi Vũ Hán,"Dịch viêm phổi Vũ Hán bùng phát khiến nhiều chuyên gia kinh tế nhận định, chỉ số tăng trưởng kinh tế Trung Quốc trong quý 1/2020 sẽ chỉ ở mức 4%.",03-02-2020,"['Trung Quốc', 'kinh tế Trung Quốc', 'Virus viêm phổi Vũ Hán', 'tăng trưởng kinh tế', 'virus corona', 'dịch bệnh', 'bệnh truyền nhiễm', 'Virus viêm phổi']"
613492,Thế giới,475 người đã xuất viện ở Trung Quốc sau điều trị virus corona,Tính tới cuối ngày 2/2 đã có tổng cộng 475 bệnh nhân tại Trung Quốc được xuất viện sau quá trình điều trị do nhiễm virus corona mới (2019-nCoV).,03-02-2020,"['Virus viêm phổi Vũ Hán', 'virus corona']"
617182,Thế giới,TQ chế thành công bộ xét nghiệm phát hiện Covid-19 trong 15 phút,"Đại học Nankai của Trung Quốc vừa tuyên bố đạt đột phá trong phát triển một bộ xét nghiệm nhanh virus corona chủng mới gây bệnh viêm phổi cấp (Covid-19), có thể cho kết quả chỉ trong 15 phút.",17-02-2020,"['virus corona', 'Virus viêm phổi', 'COVID-19', 'Trung Quốc']"
616791,Thế giới,Hình ảnh virus Covid-19 len lỏi trong tế bào người,Virus corona chủng mới gây bệnh viêm đường hô hấp cấp (Covid-19) là những đốm li ti được hình thành từ ADN hoặc ARN bên trong màng protein.,16-02-2020,"['COVID-19', 'Trung Quốc', 'Virus viêm phổi', 'virus corona']"
505034,Thế giới,Khủng hoảng chính trị trầm trọng xảy ra ở Venezuela thế nào?,Venezuela đang lún sâu vào khủng hoảng chính trị trầm trọng chưa từng thấy khi lãnh đạo phe đối lập Juan Guaido bất ngờ tự xưng là tổng thống lâm thời của nước này.,26-01-2019,"['cắt quan hệ ngoại giao', 'Venezuela', 'khủng hoảng chính trị', 'Mỹ', 'Donald Trump']"
501038,Thế giới,Vua Malaysia bất ngờ thoái vị sau khi cưới nữ hoàng sắc đẹp Nga,Quốc vương Malaysia Muhammad V bất ngờ tuyên bố thoái vị chỉ vài tuần sau khi ông kết hôn với một nữ hoàng sắc đẹp Nga.,07-01-2019,"['Malaysia', 'thoái vị', 'Quốc vương Malaysia', 'nữ hoàng sắc đẹp', 'Vua Malaysia']"
612925,Thế giới,Người bình phục có khả năng tái nhiễm virus corona,"Một chuyên gia y tế Trung Quốc hôm 31/1 đưa ra lời cảnh báo trên. Ông cho rằng, những người đã khỏi bệnh viêm phổi vẫn có nguy cơ nhiễm lại virus.",01-02-2020,"['dịch bệnh', 'Virus viêm phổi Vũ Hán', 'Trung Quốc', 'bệnh truyền nhiễm', 'Virus viêm phổi', 'virus corona']"
505252,Thế giới,"EU ra tối hậu thư, Venezuela muốn điều đình với Mỹ","Liên minh châu Âu (EU) cảnh báo sẽ ""hành động"", kể cả công nhận lãnh đạo đối lập Venezuela là tổng thống nếu Caracas không tổ chức các cuộc bầu cử mới.",27-01-2019,"['cắt quan hệ ngoại giao', 'khủng hoảng chính trị', 'Venezuela', 'tối hậu thư', 'Mỹ', 'EU']"
510658,Thế giới,Hai người phụ nữ quan trọng tại thượng đỉnh Mỹ - Triều,Họ là những người luôn xuất hiện trong những cuộc tiếp xúc giữa Tổng thống Mỹ Donald Trump và nhà lãnh đạo Triều Tiên Kim Jong Un tại hội nghị thượng đỉnh Mỹ - Triều lần 2.,28-02-2019,"['hội nghị Mỹ Triều', 'Donald Trump', 'Kim Jong Un', 'thượng đỉnh mỹ triều']"
612950,Thế giới,Nhật phân ly thành công virus corona,"Viện Nghiên cứu bệnh truyền nhiễm quốc gia Nhật Bản (NIID) hôm 31/1 cho biết đã nuôi cấy và phân ly thành công loại virus corona mới, được ghi nhận lần đầu ở Vũ Hán, từ một người ở Nhật được xác nhận mang virus này.",01-02-2020,"['virus corona', 'Virus viêm phổi Vũ Hán', 'Trung Quốc']"
613316,Thế giới,Nguy cơ phát tán hàng chục virus lạ từ lớp băng hơn vạn năm,Một nghiên cứu mới đây cảnh báo tình trạng băng tan toàn cầu có nguy cơ “giải phóng” các loại virus và vi khuẩn lạ bị giam giữ hàng trăm nghìn năm trong các lớp băng cổ.,03-02-2020,"['băng tan', 'Trái đất nóng lên', 'virus', 'vi khuẩn']"
509417,Thế giới,Thế giới 24h: TQ rầm rộ 'khoe' tên lửa,Lực lượng tên lửa của Quân Giải phóng nhân dân Trung Quốc (PLA) mới đây đã công bố một đoạn video quảng bá về loại tên lửa đạn đạo liên lục địa DF của nước này.,22-02-2019,"['vũ khí Trung Quốc', 'tên lửa DF', 'vũ khí quân sự', 'tên lửa Trung Quốc', 'Trung Quốc', 'tên lửa đạn đạo']"
619956,Thế giới,Bé gái gây bão mạng khi 'cau mày' với bác sĩ ngay khi lọt lòng,"Bé Isabela Pereira de Jesushas người Brazil đã trở thành một hiện tượng mạng, khi bức ảnh cô bé nhìn bác sĩ một cách đầy cáu kỉnh được chia sẻ với tốc độ chóng mặt trên mạng xã hội.",27-02-2020,"['bé gái', 'trẻ sơ sinh', 'hiện tượng mạng', 'bác sĩ', 'Brazil']"
620020,Thế giới,Phó tổng thống Iran nhiễm Covid-19,"Phó tổng thống Iran, bà Masoumeh Ebtekar, hôm nay (27/2) đã được xác nhận dương tính với virus corona chủng mới.",27-02-2020,"['COVID-19', 'virus corona']"
612677,Thế giới,Châu Phi có nguy cơ thành ổ dịch Vũ Hán thứ hai,"Sự thiếu thốn các phòng thí nghiệm và dụng cụ y tế ở châu Phi đang làm dấy lên lo ngại rằng, các nước trong khu vực này đang đối mặt với nguy cơ virus viêm phổi bùng phát mạnh.",03-02-2020,"['Virus viêm phổi', 'Virus viêm phổi Vũ Hán', 'Trung Quốc', 'bệnh truyền nhiễm', 'châu Phi', 'dịch bệnh']"
616396,Thế giới,"Xét nghiệm không ngừng nghỉ Covid-19, TQ điều thêm hàng nghìn bác sĩ tới Vũ Hán","Đội ngũ nhân sự làm việc tại một phòng thí nghiệm ở Vũ Hán, tâm dịch Covid-19, đã và đang làm việc không ngừng nghỉ để phát hiện các trường hợp nhiễm bệnh.",14-02-2020,"['COVID-19', 'Virus viêm phổi', 'virus corona', 'Trung Quốc']"
612397,Thế giới,‘Cuộc sống tận thế’ của du học sinh ở tâm dịch virus Vũ Hán,"Sinh viên người Mỹ Nicholas Schneider gần một tuần nay đã cố tìm mọi cách để rời khỏi thành phố Vũ Hán, Trung Quốc nhưng tất cả nỗ lực của anh đều thất bại.",30-01-2020,"['Virus viêm phổi Vũ Hán', 'dịch viêm phổi ở trung quốc', 'virus corona', 'bệnh viêm phổi trung quốc']"
616233,Thế giới,Cụ ông 112 tuổi trở thành người đàn ông cao tuổi nhất còn sống,Một cụ ông 112 tuổi người Nhật đã được trao danh hiệu người đàn ông còn sống cao tuổi nhất thế giới.,13-02-2020,"['cụ ông', 'Kỷ lục Guiness thế giới', 'Nhật Bản', 'Nhật', 'người sống lâu nhất']"
616411,Thế giới,WHO xác nhận Triều Tiên chưa nhiễm Covid-19,"Một quan chức của Tổ chức Y tế thế giới (WHO) cho biết, Triều Tiên chưa thông báo về bất cứ trường hợp nào được xác nhận nhiễm virus corona mới, còn gọi là Covid-19.",14-02-2020,"['virus gây viêm phổi', 'virus corona', 'COVID-19']"
505229,Thế giới,Khoảnh khắc máy bay ném bom Nga gặp nạn thảm khốc,Đoạn video vừa xuất hiện trên mạng đã ghi lại cảnh một máy bay ném bom chiến lược Tu-22M3 của Nga gặp nạn thảm khốc ở vùng Murmansk.,27-01-2019,"['Nga', 'máy bay ném bom siêu thanh', 'Tu-22M3', 'vũ khí', 'tai nạn hàng không']"
505246,Thế giới,"Đánh bom kép ở nhà thờ Philippines, hàng chục người thương vong","Ít nhất 19 người thiệt mạng và hàng chục người khác bị thương sau khi hai quả bom phát nổ gần nhà thờ Thiên Chúa giáo La Mã trên đảo Mindanao, Philippines.",27-01-2019,"['đánh bom', 'nổ bom', 'Philippines']"
505017,Thế giới,Thế giới 7 ngày: Venezuela căng thẳng tột độ,"Trong tuần qua, thế giới trải qua nhiều sự kiện quan trọng, nổi bật là tình hình bất ổn ở Venezuela, chính phủ Mỹ tiếp tục đóng cửa và Mỹ - Triều chốt thời điểm hội nghị thượng đỉnh Trump-Kim.",26-01-2019,"['thế giới 7 ngày', 'Venezuela', 'Trung Quốc', 'thượng đỉnh Trump – Kim', 'MH370', 'Mỹ', 'Triều Tiên']"
